event_ID,text,date,Year,people
544,"The Dean of Windsor than read some appropriate prayers . The ceremony concluded by the choir singing an anthem , "" Blessed are the dead which die in the Lord . """,1870-12-15,1870,The Dean of Windsor
607,"Prince and Princess Christian returned to Frogmore on Thursday from visiting the Earl and Countess Vane , at Wynyard - park , Stockton .",1870-12-26,1870,Countess Vane|Stockton
227,"Her Majesty and their Royal Highnesses Princess Louise , Prince Arthur , and Princess Beatrice , attended Divine Ser vice at Osborne this morning .",1870-08-01,1870,Arthur
688,"The Princess of Wales , attended by the Marchioness of Carmarthen , drove out yesterday .",1870-02-08,1870,
251,"Prince Leopold drove out , attended by Mr. Duckworth . The Judge - Advocate - General had an audience of Her Majesty yesterday .",1870-08-05,1870,Duckworth
1239,Their Royal Highnesses Princess Victoria and Princess Maude of Wales arrived at Osborne yesterday .,1870-07-20,1870,
2580,The Rev. Dr. Taylor officiated .,1870-10-26,1870,Taylor
1480,"At the Levée held by the Prince of Wales on the Queen's behalf at St. James's Palace on Tuesday last , the Dean of Ely was presented , on his appointment , by the Bishop of Ely .",1870-03-04,1870,Dean|Ely
1946,"The Duke of Rexburghe , the Hon . Eva Macdonald , and Colonel H. and the Hon . Mra , Ponsonby dined with the Queen yesterday .",1870-03-21,1870,Eva Macdonald|Colonel H.|Ponsonby
1845,"The Princess of Wales , attended by the Hon . Mrz , Stonor , drove out yesterday ,",1870-03-12,1870,Stonor
1860,Prince Leopold arrived at the Castle shortly beforo 6 o'clock . Air . Duckworth was in attendance .,1870-03-14,1870,Leopold
1364,"Princess Louise and Princess Beatrice , attended by the Hou , Harriett Phipps , went out driving .",1870-06-14,1870,Louise|Hou|Harriett Phipps
2034,Her Majesty afterwards wout to look at the new church at Esher .,1870-03-31,1870,
859,"Prince Leopold walked in the grounds , attended by Mr. Duckworth .",1870-01-01,1870,Duckworth
785,The Prince and Princess of Wales drove out on Satur day .,1870-02-21,1870,
2304,"The Prince of Wales , accompanied by the Prince of Teck and Count Gleichen , and attended by Colonel Kingscote , Lieutenant - Colonel Teesdale , and Lieutenant - Colonel Ellis , was present on Saturday morning at the guard mounting parade in St. James's Park , in honour of the Queen's birth . day .",1870-05-30,1870,Kingscote|Ellis|Queen
2517,Her Majesty continues to receive very favourable ac counts of Princess Louis of Hesse and the infant Prince .,1870-10-15,1870,
916,Lieutenant - General the Hon . C. and Mrs. Grey had the honour of dining with the Queen and the Royal Family yesterday .,1870-01-13,1870,Grey|Queen
1326,The Rev. Dr. Caird arrived at the Castle .,1870-06-07,1870,Caird
1452,"The Princess of Wales afterwards drove out , atten - led by the Hon . Mrs. W. Grey .",1870-06-28,1870,W. Grey
1256,"The Prince of Wales , attended by Lieutenant - Colonel Ellis and Mr. Knollys , left Marlborough - house last evening for Grimsby , en route for Denmark .",1870-07-23,1870,Ellis|Knollys|Grimsby
459,"His Royal Highness Prince Arthur , attended by Colonel Elphinstone and Lieutenant Fitzgerald , Rife Brigade ; and the Right Hon . G. J. Goschen arrived at the Castle .",1870-12-05,1870,Arthur|Lieutenant Fitzgerald|G. J. Goschen
1332,"The Princess of Wales drove out yesterday , attended by the Hon . Mrs. Coke .",1870-06-08,1870,Coke
2361,"BALMORAL , Nov. 6 . The Queen and Princess Beatrice , attended by the Duchess of Roxburgh and Viscount Bridport , were present at Divine Service at the parish church of Crathie . The Rev. Dr. Taylor officiated .",1870-11-09,1870,Viscount Bridport|Taylor
2009,"The Queen , Princess Louise , Prince Leopold , and Princess Beatrice , and the Ladies and Gentlemen in Waiting , were present at Divine service , which was performed in the house by the Rev. R. Duckworth .",1870-03-28,1870,Louise|Prince Leopold|R. Duckworth
1094,The Prince and Princess of Wales drove out yesterday morning .,1870-07-08-005_col_1,1870,
30,Prince and Princess Christian remained to iuncheon .,1870-04-04,1870,
677,"The Princess of Wales , attended by the Marchionoss of Carmarthen , drove out .",1870-02-07,1870,
2104,The Earl of Camperdown and Colonel H. Lynedoch Gar diner have arrived at the Castle as Lord and Groom in Waiting .,1870-05-09,1870,H. Lynedoch Gar|Groom
2696,The Right Hon . G. J. Goschen and the Rev. Dr. Charteris had the honour of dining with Her Majesty .,1870-09-21,1870,G. J. Goschen|Charteris
2515,The Chancellor of the Exchequer and Mrs. Lowe arrived i in town from Nottingham yesterday afternoon and after wards proceeded to Caterham .,1870-10-14,1870,Lowe|Caterham
272,"Prince and Princess Philip of Würtemberg and the Prince of Leiningen visited the Queen , and remained to",1870-08-08,1870,Queen
1230,"The Prince of Wales , attended by Lord Alfred Hervey , Major Grey , and Mr. Fisher , went to the Agricultural - kall , Islington , on Saturday , and opened the Workmen's Inter national Exhibition on behalf of Her Majesty the Queen .",1870-07-18,1870,Alfred Hervey|Grey|Fisher
2288,"The King of the Belgians visited the Prince and Prin cess of Wales at Marlborough House , and remained to lun cheon .",1870-05-27,1870,Prin
776,"tary ) . At this meeting his Royal Highness the Prince of Wales was elected President of the Commission in the place of the late Earl of Derby , and his Koyal Highness Prince Christian and the Earl of Derby were elected members of the Commission .",1870-02-19,1870,
724,The Rev. George Prothero officiated .,1870-02-14,1870,George Prothero
2649,"BALMORAL , SEPT . 7 . The Queen went out in the morning , accompanied by Princess Louise , and Her Majesty drove in the afternoon , attended by Lady Churchill and the Hon . Mrs. H. Pon sonby .",1870-09-10,1870,Louise|Lady Churchill|H. Pon
487,"Their Royal Highnesses the Dake of Nemours , Princess Marguerite , and Princess Blanche of Orleans , and their Royal and Imperial Highnesses Count and Countess d'Eu visited the Queen to - day and remained to luncheon .",1870-12-08,1870,
1098,The invitations to the Garden Party given by the Prince and Princess of Wales at Chiswick on Wednesday afternoon included the following :,1870-07-08-005_col_1,1870,
1509,"Lord Napier of Magdala arrived at the Castle yesterday , and had the honour of dining with the Queen and the loyal Family . Lord Napier left for London this morning . BUCKINGHAM PALACE .",1870-03-09,1870,Queen
711,"The Earl of Bassborough ( Lord Steward ) and Lord Otho Fitzgerald ( Controller of the Household ) arrived at Os borne to - day , and presented Addresses to Her Majesty from both Houses of Parliament in reply to the Queen's Speech .",1870-02-11,1870,Steward|Otho Fitzgerald|Queen
643,"The Duke of Cambridge , attended by Colonel the Hon . James Macdonald , left Frognore yesterday to return to",1870-02-03,1870,The Duke of Cambridge|James Macdonald
2325,"Professor Lister , Surgeon Extraordinary to the Queen , arrived at the Castle .",1870-11-02,1870,
2526,"The Queen walked out with the Princess Louise , and drove uut in the afternoon with Prince Leopold , attended by the Hon . Lady Biddulph .",1870-10-17,1870,Prince Leopold|Lady Biddulph
1195,Their Royal Highnesses the Duke of Nemours and Princess Marguerite of Orleans and their Royal Highnesses the Count and Countess of Paris have left the Castle . Miss Van de Weyer has also left the Castle .,1870-07-14,1870,
1238,"The Queen drove out yesterday afternoon , accompanied by Princess Louise , and Her Majesty walked in the grounds this morning with Princess Loaise and Princess Beatrice .",1870-07-20,1870,Louise
2608,"Prince and Princess Christian , attended by Lady Susau Melville and Captain the Hon . C. Eliot , returned to Malvern on Saturday froin visiting Lady Emily Foley at Stoke Editi park , and left on Monday tor Dunrobin Castle , on a visit to the Duke ant Duchess of Sutherland .",1870-09-01,1870,Lady Susau Melville|C. Eliot|Lady Emily Foley|Dunrobin Castle
1374,"BALMORAL CASTLE , JUNE 16 . The Queen drove yesterday to the Linn of Dee , accom panied by Princess Beatrice , and attended by the Duchesa Dowager of Athole and the Hon . Eva Macdonald .",1870-06-18,1870,Linn|Beatrice|Eva Macdonald
1217,"The Queen walked in the grounds this morning , accom panied by Princess Louise .",1870-07-16,1870,
1260,"The Queen and Princess Louise , attended by Lady Water park , drove out yesterday afternoon .",1870-07-25,1870,Lady Water
410,"BALMORAL , AUG . 25 . The Queen drove out this morning , accompanied by Prince Leopold , and went out in the afternoon with Prin cess Beatrice .",1870-08-29,1870,Prince Leopold
1501,"WINDSOR CASTLE , MARCH 7 . The Queen , accompanied by Princess Louise , walked and drove in the grounds this morning . Prince Leopold also",1870-03-08,1870,Louise|Prince Leopold
2583,"The Princess of Wales drove out yesterday , attended by Viscountess Walden .",1870-10-26,1870,Viscountess Walden
1839,"Princess Louise , attended by Lady Churchill and Colonel Du Plat , was present at the Ball given by the Prince and Princess of Wales at Marlborough House .",1870-03-12,1870,Louise|Lady Churchill|Ball
211,"The Queen , accompanied by Princess Louise and Madam Van de Weyer , drove out yesterday afternoon , and Her Majesty walked and drove this morning with Princess Louise .",1870-04-30,1870,Louise|Louise
294,"The Right Hon . W. E. Forster arrived at Osborne yes terday , and had the honour of dining with the Queen and the Royal Family .",1870-08-08,1870,W. E. Forster|Queen
1919,"Her Majesty walked and drove in the grounds this morn ing , accompanied by Princess Louise .",1870-03-19,1870,Louise
763,"A meeting of the Governors of Wellington College was held on Wednesday in the Palace of Westminster . Pre sent , His Royal Highness the Prince of Wales ( President ) , his Grace the Duke of Wellington ( Vice - President ) , his Royal Highness the Duke of Cambridge , Earl Stanhoge , Viscount Everale , the Bishop of Winchester , Lord Chelma ford , Sir John Pattington , Lieutenant - General J. Peel , Sir J. Weir Hogg , Mr. T. Baring , M.P. , Mr. J. Walter , M.P. , Mr. Cox , and the Rev. G. R. Gleig , M.A. Colonel the Hon , W. P. Talbot Chon , secretary ) , Dr. Benson ( the Hoad Master ) , and Mr. Chance ( the secretary ) also attended .",1870-02-18,1870,Grace|the Duke of Cambridge|Earl Stanhoge|Viscount Everale|Chelma ford|John Pattington|J. Peel|J. Weir Hogg|T. Baring|M.P.|J. Walter|M.P.|Cox|G. R. Gleig|W. P. Talbot Chon|Benson|Chance
80,"Princess Blanche of Orleans has left the Castle , attended by Mdlle . St. Aubyn .",1870-04-11,1870,
771,"The suite in attendance consisted of the Dowager Duchess of Athole , the Hon . Caroline Cavendish , General the Hon . C. Grey , Viscount Bridport , Colonel the Hon . A. Har dinge , C.B. , Mr. Duckworth , and Mr. Sahl .",1870-02-19,1870,Caroline Cavendish|C. Grey|Viscount Bridport|Duckworth|Sahl
2272,His Royal Highness went afterwards to St. Bartholo mew's Hospital ( of which he is President ) and minutely inspected all the wards .,1870-05-24,1870,
177,"The Prince and Princess of Wales , accompanied by Prince Albert Victor , Prince George , and Princess Louise , and at tended by the Hon . Mrs. Stonor and Major Grey , returned to Marlborough - house yesterday from visiting the Queen at Osborue .",1870-04-21,1870,Prince George|Louise|Stonor|Major Grey
931,The Rev. G. Prothero preached the sermon .,1870-01-17,1870,G. Prothero
1132,Prince and Princess Christian dined with the Queen yes terday .,1870-07-11,1870,
193,"The Queen walked and drove this morning , accompanied by Princess Louise .",1870-04-26,1870,Louise
389,"The Prince and Princess of Wales , attended by the Hon . Mrs. Hardinge , dined with the Queen last night .",1870-08-24,1870,Hardinge
368,"WINDSOR OASTLE , AUG . 17 . The Queen and Princess Beatrice went out in the grounde this morning .",1870-08-18,1870,
2148,"The fourth carriage conveyed Viscountess Clifden ( Lady of the Bedchamber ) , the Earl of Bessborough ( Lord Steward ) , the Marquis of Ailesbury , K.G. ( Master of the Horse ) , and Major - General F. H. Seymour ( Equerry in Waiting ) .",1870-05-12,1870,Viscountess Clifden|Bedchamber|the Earl of Bessborough|Steward|Marquis|F. H. Seymour|Equerry
48,The Countess of Caledon has succeeded Lady Churchill as Lady in Waiting .,1870-04-06,1870,Lady Churchill|Lady
562,"WINDSOR CASTLE , DEC . 17 . Her Majesty's dinner party yesterday included her Royal Highness Princess Louise , the Marquis of Lorne , the Dean of Westminster and Lady Augusta Stanley , and the Dean of Windsor and the Hon . Mrs. Wellesley .",1870-12-19,1870,Majesty|Louise|Marquis|the Dean of Westminster|Lady Augusta Stanley|the Dean of Windsor|Wellesley
102,"The Princess of Wales drove out , attended by the Hon . Mrs. Stonor .",1870-04-12,1870,Stonor
420,"The Queen went out in the morning , attended by Lady Churchill .",1870-08-30,1870,Lady Churchill
1838,"BUCKINGHAM PALACE , MARCH 11 . The Royal dinner party last evening included their Royal Highnesses Prince and Princess Christian and Princess Louise , his Royal flighness the Duke of Cambridge , the Earl and Countess of Besshorough , the Earl of Derby , and the Earl of Clanwilliam .",1870-03-12,1870,Louise
691,The Queen went out driving .,1870-02-09,1870,
1478,The Right Hon . R. Lowe left the Castle this morning .,1870-03-04,1870,R. Lowe
2307,"In the afternoon the Princess of Wales drove out , accom panied by the Princess of Teck .",1870-05-30,1870,
1000,"Prince and Princess Christian , attended by Lady Susan Melville and Lieutenant - Colonel G. G. Gordon , dised with Monsieur and Madame Van de Weyer yesterday evening , at their residence in Arlington - street .",1870-07-01,1870,Lady Susan Melville|G. G. Gordon
964,Despatches were received yesterday at the Colonial - office from the Governors of the Cape of Good Hope and St ... Helena . Despatches were sent to the Goveruor - General of Canada .,1870-01-26,1870,
599,The Queen and their Royal Highnesses Princess Louise and Princess Beatrice attended Divine service at Whip pingham Church this morning .,1870-12-26,1870,
781,Prince and Princess Christian dined with Her Majesty in the evening .,1870-02-21,1870,
1390,Two rows of chairs ( one on each side of the centre ) were ap propriated to the sponsors and the Royal personages invited to be present .,1870-06-21,1870,
1529,"fence beyond The Elk appeared with a clear lead of Prim rose , Gardener lying third , Guy of Warwick fourth , and close in whose track came Karslake , Q.C. , Alcibiade , Hall Court , and Cristal , and The Doctor with The Colonel and t Sarney somewhat mending their positions as they approached Becher's Brook , which there they all cleared without a mistake . onlanding the Elk considerably improved his lead , but as saw great good in each , though possibly his natural symps He they ran along the lower ground Primrose ran up to hisquar thies might be more with the Union ; but he recognized in ters , and raced with him to the succeeding water jump , the League much earnestuess , a great desire to help ax known as "" Valentine's Brook , "" which the latter cleared in advance , the pair as they came along the canal side being masters , who , after having placed me in a position that com - duty was to fortere they could promote that their "" I have told you of the hypocrisy of these English well as they might in that great cause . He proceeded to analyze Mr. Forster's measure , and remarked followed by Karslake , Guy of Warwick , Q.C. , and pelled me to rest upon my knees and elbows in order to good in the Bill and amend what was defective . abreast ; but as they came across the meadows they spread me chains and a Bible . I make no complaint of the attention in the Bill . First , whether they agreed in Alciliade , who cleared the fence on to the Course nearly take my food , half starve me , deprive me of light , and give There were at least five characteristics worthy their anything in the race , and when he has been mentioned along land . Lady Tombs , on her marriage , by the Duchess of Suther - with the cast - offs from the flat , Thalassius and Guy of War- out , and came on leading in line to the gorse hurdles , penalties which my masters require me to endure all the details of the measure or not , they were bound to re wick , one has come nearly to the end of the list . Mr. T. which Guy of Warwick reached in advance , but , swerv my fate is to suffer ; but I maintain that I have the There was no treating religion as if it was something illicit ; cognize the thorough fairness and earnestness of the Bill . V. Morgan met with a great disappointment this morning ing from it , jumped it sideways , and lost his place right to acquaint the world with the treatment to there was throughout a recognition that there must be a when Thalassius pulled up lame after a gallop , and he had to the Elk , who came down to the water jump which I am subjected , and that it is illegal to suppress good healthy tone in their schools ; and that tone they hopedy Wentworth , by Countess Beauchamp , Mrs. Wilberforce , on her marriage , by Countess Stan- to be soratched at 10 o'clock . The Doctor continued all in front of the Stand with a clear lead , and cleared my letters which speak of that treatment . The minute new very well , and he believed Mr. Forster , if he were the rage to the last , and the only change of moment was the the obstruction a couple of lengths in front of Prim - precautions taken by the prison authorities to prevent me asked , would frankly say so , must depend upon the teach rose , Karslake , Gardener , Pretentaino II , Cristal , Q. C. , from writing letters are as ridiculous as they are abhorrent . independence . Many said the Bill was a compromise , but coming of The Colonel to 6 to 1 . ing of religion and morality . The second characteristic was Pearl Divor , Surney , Alcibiade , The Doctor , and The The most outrageous proceeding was to strip me naked once he could t Colonel , Casse Tête , and Hall Court , in the order we a day during several months and to examine my arms , legs , garded the measure as one which emanated from a very ild not agree with such speakers or thinkers . He re Most of the books seemed to be full , and except for the have named them , but widely separated ; the two latter and all parts of my body . This occurred at Millbank every earnest man , who had carefully studied all sides of the outlay on The Doctor there would have been little to record . being completely beaten , and evidently out paced , and were day in February and up to May , 1867. One day I resisted , ness of the measure , as almost all other measures , question . The third characteristic was the comprehensive MARCHIONESSES . - Clanricarde , Normanby , and Louisa We mentioned yesterday that sporting Liverpool had not after persevered with . No material change occurred and then there came five officers who assailed me with from whatever quarter they had come , failed to recognize "" plunged "" for the Cheltenham horse almost to a man , with the leading division until Beecher's Brook was reached blows and tore off my clothing . Once I was enabled to that a measure to be national must fix its attention at one though here and there there were dissentient voices to be a second time , when the Elk resigned his place to Primrose , send outside a letter and that procured me a visit from found , who doubted his staying this long course , where both who in turn was headed by Surney and Gardener at the Messrs . Knox and Pollock , two police magistrates , sparse rural population . The fourth characteristic - and speed and stoutness are so much required . It was no secret following fence , and as they neared the turning flag for home What a mockery it was to send two Government offl- nister - was the Conservatism of the Bill , and it did not they might smile at the term , regard to a Liberal Mi The Royal Body Guard of the Yeomen of the that The Doctor's party relied on his trial with Brick , by the railway the latter gave way , as did Guy of Warcials to ascertain the truth concerning English pri- saperseile local effort and did not abrogate parental autho Guard was on duty , under the command of the LADIES . Margaret Beaumont Buxton , Victoria Buxton , which was putting the latter in at 9st . 71b . , a weight at wick , who appeared to tire through the plough , and sons ! These gentlemen refused to take note of what I rity . The Bill endeavoured to use up all existing agencies Duke of St. Albans , the Captain . The Exon in Egerton of Tatton , Townsend Farquhar , Katharine Evans , pointed to some half - dozen , being all close together ; for Colonel , and Karslake , but the latter almost immediately subject which did not suit them they stopped me by saying whole subject of education , but rather to supplement and Rosamond Spencer Churchill , Alwyne Compton , Dashwood , which it was supposed he could not lose . The betting their places were then taken by The Doctor , The had of importance to tell them . When I approached a that were at all of a useful kind , and to supplement them A Guard of Honour of the Grenadier Guards was Hamilton , Haye , Hutt , Caroline Kerrison , Charlotte Legge , after taking 4 to 1 about The Doctor and 6 to 1 about The was added to the beaten division , and Keystone then drew that with the discipline of the prison they had nothing to carry on what was good . The fifth characteristic was Alexander Gordon Lennox , Lewis , Lyttelton , Lyveden , Colonel , they laid 10 to 1 each about four or five others . The Her Majesty the Queen entered the Throne - A'Kenna , Florence Leslie Melville , Sophia Leslie Melville , place betting seemed most to affect Gardener , Pearl Diver , room shortly after 3 o'clock , accompanied by their Maria Ponsonby , Thorold , Trevelyan , Rose Weigall , and Alcibiade , and Hall Court , and there was quite a rush to",1870-03-10,1870,Prim|Gardener|Guy of Warwick|Alcibiade|Sarney|Forster|Karslake|Bill|Lady Tombs|Thalassius|Guy|T.|Bill|V. Morgan|Thalassius|Wilberforce|Stand|Forster|Prim|Karslake|Q. C.|Bill|Pearl Divor|Alcibiade|Casse Tête|Louisa|Elk|Knox|Brick|Margaret|Victoria Buxton|Bill|Karslake|Rosamond Spencer Churchill|Alwyne Compton|Hamilton|Haye|Caroline Kerrison|Charlotte Legge|Alexander Gordon Lennox|Leslie Melville|Leslie Melville|Gardener|Pearl Diver|Maria Ponsonby|Rose Weigall|Alcibiade
971,"A Committee of the Lords of Her Majesty's Most Honourable Privy Council , consisting of the Lord President , the Lord Privy Seal , the Right Hon . H. A Bruce , and the Right Hon . W. E. Forster , met yesterday at the Privy Council Office , Whitehall , to consider certain questions con nected with municipal charters . The Attorney - General sttended the committee .",1870-01-28,1870,W. E. Forster
1781,"Her Royal Highness Princess Louise dined with the Prince and Princess of Wales at Marlborough House yesterday , and accompanied the Princess of Wales to the Gaiety Theatre in the evening .",1870-03-11,1870,Louise
488,Prince and Princess Christian came up from Fragmore and met their Royal Highnesses aud Count and Countess d'Eu .,1870-12-08,1870,
2721,The Queen and the two Princesses visited the Prince and Princess of Wales at Abergeldie in the afternoon .,1870-09-28,1870,
40,"The Bishop of Manchester also arrived , and was intro duced to Her Majesty's presence by the Right Hon . H. A. Bruee , and did homage .",1870-04-05,1870,Majesty|H. A. Bruee
674,The Queen and their Royal Highnesses Princess Louise and Princess Beatrice attended Divino service at Osborne to - day .,1870-02-07,1870,Beatrice
13,"The Prince and Princess of Wales , attended by the Hon . Mrs. Stonor and Captain Ellis , visited the Exhibition of the Society of British Artists yesterday .",1870-04-02,1870,Stonor|Ellis
77,"WINDSOR CASTLE , APRIL 9 . The Queen drove out yesterday afternoon , attended by the Countess of Caledon and the Hon . Eva Macdonald . Princess Louise , attended by Lady Churchill , weat out riding . Princess Beatrice and Princess Blanche of Orleans drove out .",1870-04-11,1870,Eva Macdonald|Louise|Lady Churchill|Beatrice
976,"A deputation of the National Committee for the Recep tion of the King of the Belgians , consisting of the Lord Mayor of London , Lieutenant - Colonel Durnford , Mr. Edward Gourley , Captain Mercier , and Dr. Mill , arrived at Osborne yesterday , and had the honour of submitting to Her Majesty's inspection the casket containing the national address to the King and Queen of the Belgians .",1870-01-29,1870,Edward Gourley|Mercier|Mill|Majesty
536,"The Queen drove out yesterday afternoon , accompanied by the Duchess of Roxburgbe ; Prince Leopold also drove out .. :",1870-12-15,1870,Prince Leopold
1956,"The Dean of Windsor and the Hon . Mrs. Wellesley , Cap tain Henry Wellesley ( Grenadier Guards ) , and the Rev. Henry White had the honour of dining with the Queen and the Royal Family yesterday .",1870-03-22,1870,The Dean of Windsor|Wellesley|Cap|Henry Wellesley|Grenadier Guards|Henry White|Queen
1906,Lady Fanny Howard and Lady Augusta Stanley had the honour of dining with the Queen and the Royal Family in the evening .,1870-03-18,1870,Lady Fanny Howard|Lady Augusta Stanley|Queen
1450,"In the account given of the Queen's Garden Party at Windsor Castle on Friday last , it should have been stated that Viscountess Clifden attended as Lady in Waiting to her Royal Highness Princess Louise .",1870-06-28,1870,Viscountess Clifden|Lady
1226,Her Majesty and their Royal Highnesses Princess Louise and Princoss Bestrico attended Divine service at Whipping ham Church this morning .,1870-07-18,1870,Princoss Bestrico
1320,"The sernion was preached by the lev . R. W. Jelf , D.D. , Sub - Almoner to the Queen , from St. John , chap . xvi . , verses 6 and 7 .",1870-06-06,1870,R. W. Jelf
