event_ID,text,date,Year,people
1868,"The Prince and Princess of Walea , with the Ilon . Mrs. Stonor and Captain Ellis in waiting , attended Divine ser vice at the Chapel Royal , St. James's , yesterday .",1870-03-14,1870,Walea|Stonor|Ellis
602,Her Majesty distributed Christmas gifts yesterday to the wives and children of the labourers on the Osborne estate .,1870-12-26,1870,Majesty|Osborne
1518,visited the Princess of Wales .,1870-03-09,1870,
1085,"The Prince of Leiningen visited the Queen to - day , and remained to luncheon .",1870-07-08-005_col_1,1870,
1405,"Mr. W. G. Casins presided at the organ . Her Majesty then retired from the Chapel to the Green Drawing - room , accompanied by the Royal and distinguished guests , where the rest of the company followed and where the Baptismal Register was completed . Refreshments were afterwards served in the Dining - room . Lieutenant - General F. H. Seymour has succeeded Lord Charles Fitzroy as Equerry in Waiting .",1870-06-21,1870,W. G. Casins|F. H. Seymour|Charles Fitzroy|Equerry
1211,"Her Majesty the Queen , accompanied by their Royal Highnesses Princess Louise , Prince Leopold , and Princess Beatrice , left the Castle this morning at half - past 9 o'clock for Osborue . The suite in attendanco consisted of Lady Waterpark , the Hon . Mary Lascelles , Viscount Bridport , Colonel H. Ponsonby , Sir William Jenner , and Mr. Duck",1870-07-15,1870,Prince Leopold|Lady Waterpark|Mary Lascelles|Viscount Bridport|H. Ponsonby|William Jenner|Duck
2230,"Princess Louise , attended by Lady Caroline Barrington , the Hon . Eva Macdonald , and Colonel the Hon . A. Har dinge , arrived at the Castle from London .",1870-05-19,1870,Louise|Lady Caroline Barrington|Eva Macdonald
317,"Mr. George Mellish was then introduced to Her Majesty's presence by Earl de Grey and Ripon , in the absence of the Right Hon . H. Bruce , Secretary of State for the Home De partinent , and received the honour of knighthood on his appointment as Lord Justice .",1870-08-10,1870,George Mellish|Majesty|Earl de Grey|H. Bruce
1918,The Hon . Mrs. Alexander Gordon was also invited .,1870-03-19,1870,Alexander Gordon
238,"OSBORNE , AUG . 2 . The Quran an ! Pireas Beatrice drove out yesterday afternoon , attended by Viscountess Clifden ; and Her Majesty walked in the grounds this morning with Princesa Louise and Prince Arthur .",1870-08-03,1870,Viscountess Clifden|Arthur
540,"The Prince and Princess of Wales arrived from London at the same hour , and met the Queen and the Royal Family there .",1870-12-15,1870,
815,"WINDSOR CASTLE , FEB . 21 . The Queen , accompanied by Princess Beatrice , went out this morning . Prince and Princess Christian lunched with Her Majesty .",1870-02-25,1870,Beatrice
2449,"Earl de Grey , the Right Hon . W. E. Gladstone , Earl Granville , and Viscount Sydney had audiences of the Qacen .",1870-11-30,1870,Earl de Grey|W. E. Gladstone|Earl Granville|Viscount Sydney
1957,"The Prince and Princess of Wales , attended by the Hon . Mrs. Stonor and Captain Ellis , returned to Marlborough House yesterday from Kimbolton .",1870-03-22,1870,Stonor|Ellis
2435,"His Royal Highneas Prince Arthur , attended by Lleut. Colonel Elphinstone , arrived at the Castle from Greenwich Park .",1870-11-28,1870,Arthur|Lleut
266,"OSBORNE , AUG . 6 . The Queen went out yesterday afternoon , accompanied by Princess Beatrice , and Her Majesty walked in the grounds this morning with Princess Louise .",1870-08-08,1870,Beatrice|Louise
1005,Mr. George Cruikshank had the honour of submitting to the Queen his model for the monument about to be placed on the field of Bannockburn in memory of King Robert the Bruce .,1870-07-02,1870,George Cruikshank|Bannockburn|Robert the Bruce
2229,"The Queen , accompanied by Princess Beatrice and at tended by Viscountess Clifden , honoured Sir James Clark with a visit yesterday afternoon at Bagshot - park , and Her Majesty , with Princess Beatrice , drove out this morning .",1870-05-19,1870,Beatrice|Viscountess Clifden|James Clark|Beatrice
742,"The sermon was preached by the Rev. Dr. Vaughan , Master of the Temple , from Colossians , chap . 3 , v . iii .",1870-02-14,1870,Vaughan
1024,"The Queen went out in the grounds this morning , accom panied by Princess Beatrice .",1870-07-05-012_col_1,1870,Beatrice
2535,"The Duke of Argyll , the Marquis of Lorne , Sir Thomas and the Hou Lady Biddulph , and the Right Hon . W. E. Forster had the honour of dining with the Queen . The Marquis of Hertford left the Castle . Viscount Bridport arrived .",1870-10-18,1870,The Duke of Argyll|Marquis|Thomas|W. E. Forster|Marquis|Viscount Bridport
2601,The Prince and Princess of Wales attended Divine ser vice yesterday .,1870-10-31,1870,
1998,"Lady Churchill ( Lady in Waiting ) , the Hon . Mary Las celles ( Maid of Honour ) , Viscount Sydney ( Lord Chamber lain ) , Lord Methuen ( Lord in Waiting ) , Colonel Hon . A. Liddell ( Groom in Waiting ) , Lord Alfred Pagot and Colonel Du Plat ( Equerries in Waiting ) , and the Master of the Household , were in attendance on Her Majesty .",1870-03-26,1870,Lady Churchill|Mary Las|Maid|Viscount Sydney|Chamber|Methuen|A. Liddell|Groom|Alfred Pagot
2536,Prince and Princess Christian returned to Frogmore on Saturday from a visit to Lord and Lady Londesborough at Scarborough .,1870-10-18,1870,Lady Londesborough
614,Despatches were received yesterday at the Colonini Office from the Governors of the Australian Colonies and the North American Provinces . Despatches were sent to,1870-12-28,1870,
2197,"The Queen drove out yesterday afternoon , attended by the flon . Horatia Stopford and the Hon . Harriet Phipps . Prince Leopold and Princess Beatrice also went out . His Royal Highness Prince Christian , the Earl of Rose bery , Lord and Lady Muncaster , and Colonel H. and the Hon . Mrs. Ponsonby dined with the Queen .",1870-05-16,1870,Horatia Stopford|Prince Leopold|Lady Muncaster|Colonel H.|Ponsonby
1213,"Their Royal Highnesses the Grand Duke and Grand Duchess of Mocklenburg - Strelitz , attended by Lady Caro line Cast and Baron Von Eagel , the Earl and Countess Spencer , the Marchioness of Ely , and M. and Madaure Van de Weyer , have left the Castle .",1870-07-15,1870,Lady Caro|Cast|Von Eagel|Countess Spencer
1408,"Princess Louise , attended by Lady Caroline Barrington , the Hon . Emily Cathcart , and Colonel Du Plat , arrived at the Castle from London .",1870-06-23,1870,Louise|Lady Caroline Barrington|Emily Cathcart
600,"The Rev. George Prothero , assisted by the Rev. John Dalton , officiated . The Rev. George Prothero preached",1870-12-26,1870,George Prothero|John Dalton|George Prothero
804,"Her Majesty the Queen hold a Council to - day at 1 o'clock , at which were present Earl de Grey and Ripon , the Earl of Kimberley , the Right Hon . W. E. Gladstone , Viscount Sydney , and the Right Hon . H. C. E. Childers .",1870-02-23,1870,Earl de Grey|W. E. Gladstone|Viscount Sydney|H. C. E. Childers
471,"Countess Olary , Baroness Breton - Bourbaki , Madlle . Lar minat , Count Clary , and Baron Duperré were in attendance upon her Imperial Majesty .",1870-12-06,1870,Duperré
370,"Her Majesty the Queen held a Council to - day at a quarter before 3 o'clock , at which were present Earl Granville , Viscount Halifax , the Right Hon . E. Cardwell , Viscount Sydney , and the Chancellor of the Exchequer .",1870-08-18,1870,Earl Granville|E. Cardwell|Viscount Sydney
360,"His Royal Highness the Duke of Cambridge , attended by Colonel Clifton , visited Her Majesty yesterday .",1870-08-17,1870,the Duke of Cambridge|Clifton
2551,"The Prince of Wales , attended by Lieutenant - Colonel Teesdale and Mr. F. Knellys , arrived in town yesterday from Scotland .",1870-10-21,1870,F. Knellys
838,"Their Royal Highnesses the Prince and Princess of Wales , the Duchess of Sutherland , the Dowager Duchess of Athole , the Countess of Macclesfield , and Viscount Bridport dined with the Queen yesterday .",1870-02-28,1870,Viscount Bridport
458,"Prince and Princess Christian , Lady Churchill , and the Duke of Roxburghe dined with the Queen last evening .",1870-12-05,1870,Lady Churchill|Roxburghe
1494,"The Queen , accompanied by the Dowiger Deniss of Athole , walked and drove in the grounds yesterday after",1870-03-07,1870,
295,"The Princess of Wales drove out on Saturday , attended by the Hon . Mrs. Hardinge .",1870-08-08,1870,Hardinge
805,"Earl de Grey and Ripon , the Right Hon . W. E. Glad stone , Viscount Sydney , and the Right Bou . H. C. E. Chil ders , had audiences of the Queen .",1870-02-23,1870,Earl de Grey|W. E. Glad|Viscount Sydney|H. C. E. Chil
902,The Dean of Westminster officiated .,1870-01-10,1870,The Dean of Westminster
445,"WINDSOR CASTLE , DEC . 2 . The Queen walked in the grounds this morning , attended by the Duchess of Roxburghe .",1870-12-03,1870,
1027,Their Royal Highnesses afterwards returned to Marl borough House .,1870-07-05-012_col_1,1870,
2693,"The service was performed by the Rev. Dr. Charteris , one of Her Majesty's chaplains .",1870-09-21,1870,Charteris
705,"The Prince and Princess of Wales , attended by the Mar chioness of Carmarthen , the Marquis of Hamilton , and Lieutenant - Colonol Keppel , were present last evening at a ball given by the Hon . Artillery Company at their Armoury House in Finsbury .",1870-02-10,1870,Marquis|Hamilton
1291,"BALMORAL CASTLE , MAY 31 . The Queen went out yesterday morning with Princess Beatrice ; and in the afternoon the Queen and Princess Louise drove out , attended by the Duchess Dowager of Athole ,",1870-06-02,1870,Beatrice
2209,"The sermon was preached by the Lord Bishop of London , Dean of Her Majesty's Chapels Royal , from St. John , chap . 17 , v . 17 .",1870-05-16,1870,Dean
2658,The Hou . Caroline Cavendish has left Balmoral .,1870-09-12,1870,Caroline Cavendish
2246,"The suite in attendance consisted of the Hon . Harriet Phipps , Sir T. M. Biddulph , Lord Charles Fitzroy , Dr. Hoffmeister , and Mr. Sahl .",1870-05-20,1870,Harriet Phipps|T. M. Biddulph|Charles Fitzroy|Hoffmeister|Sahl
935,Prince and Princess Christian and Princess Louise also walked out .,1870-01-18,1870,Louise
2051,"The Prince and Princess of Wales , with the Hon . Mrs. Stonor and Major Groy in waiting , attended Divine service yesterday at the Chapel Royal , St. James's .",1870-05-02,1870,Stonor
2184,"The Princo and Princess of Wales had a dinner party last ovening at Marlborough - house . The company in cluded his Royal Highness the Duke of Cambridge , his Excellency the Turkish Ambassador ( Musuras Pasha ) , his Excellency the French Ambassador ( the Marquis de Lava lette ) , his Excellency the Danish Minister ( General ) de Bulow ) and Madame de Bulow , his Excellency the United States Minister ( Mr. J. L. Motley ) and Mrs. Motley , the Duke and Duchess of Suther land , the Earl of Derby , Earl Stanhope , the Countess of Morton , Viscount Royston , Lord and Lady Cecilia Bingham , Lord and Lady Muncaster , Lord Claud J. Hamilton , Admiral the Hon . Sir Henry and Lady Keppel , the Right Hor . Sir John and Lady Pakington , the Right i Hon . B. Disraeli and the Viscountess Beaconsfield , Gene ral Sir W. and Lady Codrington , Colonel C. P. Leslie , Mr. W. H. Dyke , the Rev. W. L. Onslow , Colonel the Hon . J. Macdonald ( in attendance on the Duke of Cambridge ) , General Sir William Knollys and Lieutenant - Colonel Teesdale .",1870-05-14,1870,the Duke of Cambridge|Musuras Pasha|Marquis de Lava lette|J. L. Motley|Motley|Earl Stanhope|Viscount Royston|Lady Cecilia|Lady Muncaster|Claud J. Hamilton|Henry|Lady Keppel|John|Lady Pakington|B. Disraeli|W.|Lady Codrington|C. P. Leslie|W. H. Dyke|W. L. Onslow|J. Macdonald|William Knollys
1800,Mrs. Mrs.,1870-03-11,1870,
2588,"The Queen , accompanied by Princess Beatrice , weut out in the morning , and visited the Lochnagar Girls ' School . Her Majesty drove out in the afternoon with Princess Beatrice , attended by the Hon . Lady Biddulph .",1870-10-27,1870,Beatrice|Beatrice|Lady Biddulph
1134,"Her Majesty the Queen visited the Camp at Aldershott to - day , attended by the Marchioness of Ely , the Hon . Florence Seymour , Viscoant Bridport , and Colonel H. Pon sonby .",1870-07-11,1870,Florence Seymour|Viscoant Bridport|H. Pon
849,Princess Louise visited the Princess of Wales at Marlborough - housa . and remained to luncheon .,1870-02-28,1870,Louise
1265,"OSBORNE , JULY 25 . The Queen and their Royal Highnesses Princess Louise , Prince Arthur , and Princess Beatrice walked in the grounds this morning .",1870-07-26,1870,Arthur|Beatrice
2098,"The Princess of Wales drove out , attended by the Coun tess of Mortou . FROGMORE HOUSE , MAY 6 . Her Royal Highness Princess Christian has passed good night , and is making most satisfactory progress . The infant Princess continues well .",1870-05-07,1870,
2406,"NOVEMBER 18 . The Queen , with Princess Beatrice , and attended by the Duchess of Roxburghe , returned from the Glassalt Shiel .",1870-11-21,1870,Beatrice
853,"The Prince and Princess of Wales , with the Countess of Macclesfield and Lieutenant - Colonel Keppel in waiting , attended Divine service yesterday in the Chapel Koyal St. James's .",1870-02-28,1870,Keppel
206,Lady Elizabeth de ltos had the honour of dining with the Queen and the loyal family yesterday .,1870-04-29,1870,Lady Elizabeth de ltos|Queen
321,"Lord Alfred Paret , Equerry in Waiting , was in attend",1870-08-10,1870,Alfred Paret|Equerry
760,"Princess Louise , Princess Beatrice , and Prince Leopold also went out .",1870-02-18,1870,Louise|Prince Leopold
2205,"The Prince and Princess of Wales , with the Countess of Morton and Lieutenant - Colonel Teesdale in waiting , at teuded Divine service yesterday at the Chapel Royal , St. James's .",1870-05-16,1870,Morton
2564,The Right Hou . W. E. Forster had the honour of dining with Her Majesty .,1870-10-24,1870,W. E. Forster
1840,"The Queen and Princess Louise , attended by the Duchcas of Roxburghe , drove out this morning . Lord Alfred Pagot and Colonel Du Plat were in attendance upon horseback .",1870-03-12,1870,Alfred Pagot
2050,"The Prince of Wales , attended by the Marquis of Ra milton , General Sir William and Major Grey , was present in the evening at the annual dinner of the Royal Academy at Burlington - house .",1870-05-02,1870,Marquis|Ra milton|William|Major Grey
132,The Prince of Leiningen has left Osborne .,1870-04-18,1870,Osborne
2418,"Her Majesty in the afternoon went out , attended by Lady Florence Seymour ,",1870-11-24,1870,Lady Florence Seymour
840,"Her Roval Highness the Princess of Teck visited the Queen this afternoon . P "" cate :",1870-02-28,1870,
1406,"The Prince and Princess of Wales , accompanied by Prince Albert Victor , Prince George , Princess Louise , Princess Victoria , and Princess Maud , and attended by the Hon . Irs . Coke , General Sir William Knollys , and Lieutenant Colonel Keppel , returned to Marlborough House yesterday from Cooper's - hill , near Eeham . The Princess of Wales afterwards drove out , accompanied by the Hon . Mrs. W. Grey . Their Royal Highness the Grand Duke and Grand Duchess of Mecklenburg - Strelitz arrived at St. James's Palace on Saturday from Germany , attended by Lady Caroline Cust , Baron von Engel , and Baron von Both .",1870-06-21,1870,Prince George|William Knollys|Keppel|W. Grey|Lady Caroline Cust|Baron von Engel|Baron von Both
1790,"Prince and Princess Christian and Princess Beatrice visited the Prince and Princess of Wales at Marlborough house yesterday , and remained to luncheon .",1870-03-11,1870,Beatrice
2471,The Rev. Dr. Norman Macleod arrived at the Castle and had the honour of dining with the Queen and the Royal family .,1870-10-04,1870,Norman Macleod|Queen|Royal
726,Sir Hamilton and Lady Seymour have arrived on a visit to Her Majesty .,1870-02-14,1870,Hamilton|Lady Seymour
2729,The Lord Chancellor and the Right Hon . G. J. Goschen had the honour of dining with the Queen and the Royal Family .,1870-09-30,1870,G. J. Goschen|Queen
1500,"The Princess of Wales , Prince Albert Victor , Prince George , and Princes Louis , attended by the Cupuiess of Macclesfield and General Sir Williete Kuoliy , eternal to Marlborough House from a visit to the Quern at Windsor Castle .",1870-03-07,1870,Prince George|Williete Kuoliy
1261,"Her Majesty and their Royal Highnesses Princess Louise , Prince Arthur , and Princess Beatrice attended Divine ser -vice at Osborne to - day . The Rev. George Prothero officiated .",1870-07-25,1870,Arthur|Beatrice|George Prothero
1150,"The Prince of Wales , attended by Colonel Kingscote and Major Grey , was present on Saturday at a field - day held by the Queen at Aldershott .",1870-07-11,1870,Kingscote|Major Grey
891,"The Queen drove out yesterday afternoon , accompanied by Princess Christian aud Princess Beatrice ; and Her Ma jesty walked and drove in the grounds this morning with Princess Christian .",1870-01-08,1870,Beatrice|Her Ma
978,"The Countess of Gainsborough , Colonel Ponsonby , and the Master of the Household wore in attendance .",1870-01-29,1870,Ponsonby
1299,"The King of the Belgians , his Royal Highness Duke Philip of Würtemberg , and her Imperial Highness the Archdachess Thérèse , visited the Prince and Princess of Wales , at Marlborough House , and remained to luncheon .",1870-06-03,1870,Philip
583,Prince Leopold and Princess Beatrice also went out .,1870-12-22,1870,Prince Leopold
153708,"In the afternoon The King , accompanied by The Queen , Queen Alexandra , The Princess Mary , The Princo Henry , and The Princess Vic toria , unveiled and dedicated the Memorial Cross erected by His Majesty in memory of the 77 men from the Sandringham Estate who fell in the Great War .",1920-10-18,1920,Queen Alexandra|Majesty
152238,"The Troops on parade , under the command of Colonel A. B. E. Cator ( Commanding Scots Guards , Field Officer in Brigade Waiting ) , received The King i with a Royal Salute .",1920-06-7,1920,A. B. E. Cator|The King
151373,"In attendance upon Their Majesties were : --- The Lady Desborough ( Acting Mistress of the Robes ) , the Countess Fortescue and the Lady Mary Trefusis ( Ladies in Waiting ) , the Hon . Mabel Gye and the Hon . Ursula Lawley ( Maids of Honour ) , the Lord Annaly ( Lord in Waiting ) . Mr. Harry Verney ( Groom in Waiting ) , and Captain Sir Bryan Godfrey - Faussett , R.N. , and ( aptain the the Hon . Alexander Hardinge ( Equerries in Waiting ) .",1920-07-23,1920,Annaly|Harry Verney|Groom|Bryan Godfrey - Faussett|Alexander Hardinge
151411,church and afterwards at the parish hall adjoining .,1920-07-24,1920,
151187,"The King and Queen , accompanied by the Princess Mary , and attended by the Right Hon . Edward Shortt , M.P. ( Secretary of State for the Home Department , Minister in Attend ance ) and the Ladies and Gentlemen in Waiting , disembarked from the Royal Yacht and landed at Ramsey , and proceeded by motor - car to Douglas , accompanied by the Lieutenant - Governor and Mrs. Fry , the Governor's Secretary , and the Chief Constable . On their Majesties ' arrival at Douglas the following had the honour of being presented to the King and Queen by the Lieutenant Governor - The Bishop of Sodor and Man , the Members of the Legislative Council , the Speaker of the House of Keys , and the Chair man of the Harbour Commissioners .",1920-07-16,1920,Edward Shortt|M.P.|Ramsey|Douglas|Fry|Douglas
153121,"Harman ( General Officer Commanding Cavalry Brigade ) , and Lieutenant Wall , Ist Battalion The Royal Fusiliers ( City of London Regiment ) , commanding the Royal Pavilion Guard , had the honour of dining with the King and Queen this evening .",1920-05-24,1920,
152552,"Her Majesty was received at the site of the Memorial by Viscount Doneraile ( Mayor of the City of Westminster ) , Viscount Burnham ( Chairman of the Cavell Memorial Committee ) , and the Right Hon . the Lord Mayor .",1920-03-18,1920,Majesty|Viscount Doneraile|Viscount Burnham
150518,"The Prince of Wales dined with The King , and Queen and The King and Queen of Den mark last evening .",1920-12-2,1920,
152967,The King held an Investiture in the Quad rangle of the Palace at 11 o'clock .,1920-05-13,1920,
153582,The Lady Ampthill and the Lady Mary Trefusis have succeeded the Countess of Shaftesbury and the Lady Bertha Dawkins as Ladies in Waiting to The Queen .,1920-10-11,1920,
152636,"The Prince Albert , attended by Wing - Com mander Louis Greig , visited the Royal Air Force ( Cadet ) College , Cranwell , to - day .",1920-03-24,1920,Albert|Louis Greig
150280,"The King and Queen , the Princess Mary , the Prince Henry , and the Ladies and Gentlemen in attendance , were present at Divine Service in the Private Chapel this morning .",1920-08-16,1920,
150602,"The Right Hon . Austen Chamberlain , M.P. , had an audience of His Majesty previous to the Council .",1920-12-4,1920,Austen Chamberlain|M.P.|Majesty
152378,"The Queen , accompanied by the Princess Mary , and attended by the Lady Eva Dugdale , visited the Royal School of Art Needlework , South Kensington , this afternoon ..",1920-03-11,1920,
150062,Mr. A. L. and Mrs. Wigan had the honour of dining with The King and Queen this evening .,1920-04-15,1920,A. L.|Wigan
151872,"Her Royal Highness the Princess Mary was present , attended by the Lady Joan Mul holland .",1920-07-7,1920,
151999,"The King and Queen , accompanied by the Duke of York and the Princess Mary , Their Majesties ' Guests and the Ladies and Gentle men in attendance , honoured Ascot Races with Their presence to - day .",1920-06-18,1920,
153118,"Major - General Sir Reginald Stephens ( Com mandant Royal Military College ) and Lady Stephens , Brigadier - General H. D. O. Ward ( Commanding Royal Artillery , 2nd Division ) and Mrs. Ward , Brigadier - General A. E. W.",1920-05-24,1920,Reginald Stephens|Lady Stephens|H. D. O. Ward|Ward|A. E. W.
152323,"Lieut . - Colonel Archibald Weigall was also re ceived in audience by His Majesty and kissed hands upon his appointment as Governor of South Australia , when The King conferred upon him the honour of Knighthood and invested him with the Insignia of a Knight Commander of the Most Distinguished Order of St. Michael and St. George .",1920-03-10,1920,Lieut|Archibald Weigall|Majesty|Knighthood|Michael
150265,The Right Hon . Sir George Grahame was re ceived in audience by The King and kissed hands upon his appointment as His Majesty's Ambassador Extraordinary and Plenipoten tiary at Brussels .,1920-08-14,1920,George Grahame|Majesty|Extraordinary|Plenipoten
153541,The Secretary of State for the Home Depart ment administered the Oath .,1920-11-6,1920,
153325,"The Band of the Grenadier Guards played a selection of music during the Investiture , under the direction of Captain A. Williams . The Earl of Stradbroke was received in audience by The King and kissed hands upon his appointment as Governor of Victoria , when His Majesty conferred upon him the honour of Knighthood and invested him with the Insignia of a Knight Commander of the Most Distinguished Order of St. Michael and St. George , and of a Commander of the Most Excellent Order of the British Empire ( Military Division ) . The King also invested the Countess of Strad broke with the Insignia of an Officer of the Most Excellent Order of the British Empire ( Civil Division ) . The Earl and Countess of Stradbroke sub sequently had the honour of being invited to Luncheon with Their Majesties . The Right Hon . D. Lloyd George , M.P. ( Prime Minister and First Lord of the Treasury ) had an audience of The King , and Vice - Admiral Sir Michael Culme - Seymour , Bt . ( upon relin quishing his appointment as Rear - Admiral Second - in - Command of the Mediterranean Fleet ) had the honour of being received by His Majesty . The Duke of York , attended by Captain the Hon . James Stuart , visited the Motor Exhibi tion at Olympia this morning . The Prince Henry arrived at the Palace from MARLBOROUGH HOUSE , Nov. 10 . Queen Alexandra received at Marlborough House the Members of the Military and Civil Nursing Services who have been awarded the Royal Red Cross , subsequent to the Investiture at Buckingham Palace this morning . Miss A. B. Smith ( Matron - in - Chief , Queen Alexandra's Imperial Military Nursing Service ) was also received by Her Majesty .",1920-11-11,1920,"A. Williams|The Earl of Stradbroke|Majesty|Knighthood|Michael|Luncheon|D. Lloyd George , M.P.|Michael Culme - Seymour|Majesty|James Stuart|Alexandra|A. B. Smith"
152932,"MARLBOROUGH HOUSE , MARCH 8 . The Prince of Wales visited Queen Alexandra to - day , and remained to luncheon .",1920-03-9,1920,Queen Alexandra
153659,"Alexander Newport , R.N. , Paymaster - Lieut. Commander Arthur Janion , R.N. , and the Hon . Sir Sidney Greville ( Comptroller to The Prince of Wales ) had the honour of being invited , together with the Ladies and Gentlemen of Their Majesties ' Household in Waiting ..",1920-10-13,1920,Alexander Newport|Arthur Janion|Sidney Greville
150271,"Equerry to Queen Alexandra , represented Her Majesty at the funeral of the Lady Wantage , which took place at Ardington this afternoon .",1920-08-14,1920,Equerry|Queen Alexandra
153090,"The King was escorted to and from West minster Abbey by a Captain's Escort , with Standard , of the 2nd Life Guards , under the command of Captain W. A. V. Bethell .",1920-05-19,1920,Abbey|W. A. V. Bethell
151186,The Lieutenant - Governor of the Isle of Man ( Major - General W. Fry ) and the Government Secretary ( Mr. Bertram Sargeaunt ) were re ceived by His Majesty on board the Royal Yacht .,1920-07-16,1920,W. Fry|Bertram Sargeaunt|Majesty
153785,The Lady Bertha Dawkins has succeeded the Lady Joan Verney as Lady in Waiting to Her Majesty .,1920-09-17,1920,Bertha Dawkins|Lady
152580,"The Queen , accompanied by the Prince Albert , the Princess Mary , and the Prince Henry , and attended by Mr. Harry Verney , was present at a Matinée in aid of the Blinded Soldiers ' Children Fund , which was given at the Palace Theatre this afternoon .",1920-03-20,1920,Albert|Harry Verney
