event_ID,text,date,Year,people
150281,"The Service was conducted by the Revd . Canon Edgar Sheppard , D.D. ( Sub - Dean of His Majesty's Chapels Royal and Domestic Chaplain ) .",1920-08-16,1920,Canon Edgar Sheppard|Majesty|Domestic Chaplain
153046,The Earl of Athlone visited The King .,1920-05-14,1920,
153114,"Captain E. Pauly , late the King's Royal Rifle Corps , had the honour of being received by the King and Queen .",1920-05-22,1920,E. Pauly
153039,"Miss A. B. Smith , R.R.C. ( Matron - in - Chief , Queen Alexandra's Imperial Military Nursing Service ) was also received by Her Majesty .",1920-05-13,1920,A. B. Smith
153833,"BALMORAL CASTLE , SEPT 3 . The Right Hon . Sir Frederick Ponsonby has arrived at the Castle .",1920-09-4,1920,Frederick Ponsonby
150826,"Major - General Sir Geoffrey Feilding ( upon ) relinquishing his appointment as General Officer Commanding , London District ) and Air - Marshal Sir Hugh Trenchard , Bt . ( Chief of the Air Staff ) also had the honour of being received by The King .",1920-02-23,1920,Geoffrey Feilding|Hugh Trenchard
153078,"The Lord Stanmore ( Lord in Waiting ) , the Master of the Household , and Colonel the Hon . Claude Captain Sir Charles Cust , Bt . , R.N. ( Groom and Equerry in Waiting ) , and the Deputy Master of the Household were in attendance .",1920-05-18,1920,Charles Cust|R.N.|Groom|Equerry
151819,VOLUNTARY AID DETACHMENT - Miss Margaret MONTGOMERY and Miss Jean WILSON .,1920-07-6,1920,Margaret MONTGOMERY|Jean WILSON
153290,"The Duke of York , attended by Wing - Com mander Louis Greig , arrived at the Palace from Bishopsthorpe , York .",1920-11-10,1920,Louis Greig
153273,"William Horwood ( upon his appointment as Commissioner of Police of the Metropolis ) , Lieut . - Colonel Sir John Ramsay ( upon relinquishing his appointment as Agent to the Governor - General and Chief Commissioner in Baluchistan ) , and Mr. Frederick C. Good enough ( Member of the Council of the Secretary of State for India ) had the honour of being received by The King this morning .",1920-05-8,1920,William Horwood|Metropolis|Lieut|John Ramsay|Frederick C. Good
150319,"BALMORAL CASTLE , AUG . 26 . Lieut . - Colonel F. and the Lady Cicely Hardy had the honour of dining with The King and Queen this evening .",1920-08-27,1920,Lieut|F.|Lady|Hardy
153737,His Royal Highness received General Lord Rawlinson this afternoon .,1920-10-25,1920,
150586,"The King and Queen gave a Dinner Party this evening , at which The King and Queen of Denmark , the Duke of York and the Princess Mary were present . and the following had the honour of being invited :",1920-12-3,1920,
151099,"BUCKINGHAM PALACE , JAN . 22 . To - day being the Anniversary of the death of Her late Majesty Queen Victoria , the Royal Mausoleum at Frogmore was open , by The King's Commands , between the hours of 12 and 3 o'clock , for the servants and their families to visit it , when permission to pass through was extended to some of the residents of Windsor and the neighbourhood .",1920-01-23,1920,
153676,"Captain W. R. Sexton ( upon relinquishing his appointment as United States Naval Attaché ) , Rear - Admiral Albert Niblack ( upon his appoint ment as United States Naval Attaché ) , and Colonel R. Rosetti ( upon relinquishing his ap pointment as Roumanian Military Attaché ) had the honour of being received by His Majesty .",1920-10-14,1920,W. R. Sexton|Albert Niblack|R. Rosetti|Majesty
150600,"The King held a Council at 11.30 o'clock . There were present : The Right Hon . Austen Chamberlain , M.P. ( Chancellor of the Exche quer ; acting for the Lord President ) , the Viscount Sandhurst ( Lord Chamberlain ) , the Right Hon . Sir Maurice de Bunson , Bt . , and the Right Hon . Sir Frederick Ponsonby ( Treasurer to The King and Keeper of the Privy Purse ) .",1920-12-4,1920,Austen Chamberlain|M.P.|Maurice de Bunson|Frederick Ponsonby
152267,"Knights Grand Cross . - Sir Charles HARRIS , Sir Nathaniel HIGHMORE , and The Rt . Hon . Sir Robert HORNE , M.P.",1920-06-9,1920,Charles HARRIS|Nathaniel HIGHMORE|Robert HORNE
152964,"Highness , attended by Miss Dorothy Yorke , was present this evening at a Display given by the Battersea Juvenile Organi zations in Battersea Town Hall .",1920-05-12,1920,Dorothy Yorke
152973,Dame Grand Cross . - The Dowager Countess of AIRLIE . Knight Grand Cross - Received the honour of knighthood : The Earl of PLYMOUTH .,1920-05-13,1920,
150466,"The Right Hon . Sir Eric Geddes , M.P. ( Minister of Transport ) , had an audience of The King , and Senor H. Pueyrredon ( Argentine Minister for Foreign Affairs ) and Rear - Admiral Sir Lionel Halsey ( Comptroller and Treasurer to the Prince of Wales ) had the honour of being received by His Majesty .",1920-12-20,1920,Eric Geddes|M.P.|Senor H. Pueyrredon|Lionel Halsey|Majesty
150394,The Earl of Derby subsequently had the honour of being invited to Luncheon with Their Majesties .,1920-12-13,1920,Luncheon
150739,"The Hon . Charlotte Knollys , the Hon . Lucia White , and Colonel Sir Arthur Davidson were in attendance upon Her Majesty .",1920-02-18,1920,Charlotte Knollys|Lucia White|Arthur Davidson
153611,"A Carriage Procession having been formed , the Prince of Wales , attended by his Staff , and escorted by a Prince of Wales Escort of the 2nd Life Guards , under the command of Lieutenant G. Watson , drove to Buckingham Palace by way of Victoria Street , Whitehall , Trafalgar Square , Pall Mall , St. James's Street , Piccadilly , and Constitution Hill .",1920-10-12,1920,G. Watson|Trafalgar Square|Pall Mall
152740,"The Queen , accompanied by the Princess Mary , and attended by Mr. Harry Verney , visited the National Portrait Gallery , St. Martin's Place , this afternoon .",1920-03-26,1920,Harry Verney
152098,"Voluntary Aid Detachment . - Miss Grace CURRIE , Miss Katharine EVANS , Miss Dorothy FIELD , Miss Catherine FORRESTAL , Miss Gwendolen GLOSSOP , Miss Silvia GLOSSOP , Miss Margaret GREATOREX , Miss Mary HUDSON , Miss Olga NETHERSOLE . and Miss Kathleen ROBERTS .",1920-06-26,1920,Grace CURRIE|Katharine EVANS|Dorothy FIELD|Catherine FORRESTAL|Gwendolen GLOSSOP|Silvia GLOSSOP|Margaret GREATOREX|Mary HUDSON|Olga NETHERSOLE|Kathleen ROBERTS
152794,The Prince of Wales was introduced as a Member of His Majesty's Most Honourable Privy Council .,1920-03-3,1920,Majesty
152233,"His Majesty was attended by Field - Marshal the Lord Methuen ( Colonel , Scots Guards ) , Lieut. General Sir Alfred Codrington ( Colonel , Coldstream Guards ) , Field - Marshal Sir Henry Wilson , Bt . ( Chief of the Imperial General Staff ) , Lieut . - General Sir John du Cane ( Master - General of the Ordnance ) , Lleut . - General Sir George Macdonogh ( Adjutant General to the Forces ) , Lieut . - General Sir Travers Clarke ( Quarter - Master - General to the Forces ) , Major General Sir Charles Harington ( Deputy Chief of the Imperial General Staff ) , Major - General the Hon . Sir Cecil Bingham ( Gold Stick in Waiting ) , Major General George Jeffreys ( General Officer Command ing , London District ) and the London District Staff , General the Lord Horne ( Aide - de - Camp General ) , Captain the Hon . Sir Charles Fitzwilliam_ ( Crown Equerry ) , Colonel Olive Wigram and Major Reginald Seymour ( Equerries in Waiting ) , Lieut . - Colonel the Lord Tweedmouth ( Silver Stick in Waiting ) , Colonel Sir Michael Bowman - Manifold and Colonel O. E. G. Norton ( Aides - de - Camp ) , and Lieut . - Colonel J. G. McConaghy , and The King's Indian Orderly Officers .",1920-06-7,1920,Majesty|Methuen|Scots Guards|Lieut|Alfred Codrington|Henry Wilson|Lieut|John du Cane|Lleut|George Macdonogh|Lieut|Travers Clarke|Charles Harington|Cecil Bingham|George Jeffreys|the Lord Horne|Charles Fitzwilliam|Olive Wigram|Reginald Seymour|Lieut|Michael Bowman - Manifold|O. E. G. Norton|Lieut|J. G. McConaghy
151988,"The Princess Mary , attended by the Lady Joan Mulholland , startod the now Windsor Motor F'iro Engine , at the Aloxndra Gardens this morning , and in the afternon presented the Prizos , and laid the Foundatin Stone of the Memorial Workshop , at the Gordon Boys ' Home , Woking .",1920-06-15,1920,Prizos|Woking
152242,A Royal Salute was given as The King's Pro cession passed between the old and new Guards in the Forecourt of the Palace .,1920-06-7,1920,
152754,"His Majesty afterwards visited the Grange thorpe Ministry of Pensions Hospital , and in the afternoon was present at a Football Match between Manchester City and Liverpool , which was played on the Manchester City Football Ground .",1920-03-29,1920,Majesty
150043,"The King and Queen , the Princess Mary , the Prince Henry , and the Ladies and Gentlemen in attendance , were present at Divine Service in the Private Chapel . this morning .",1920-04-12,1920,
153815,"The King and Queen , the Duke of York , the Princess Mary , Field - Marshal the Duke of Con naught , and the Ladies and Gentlemen in attendance were present at Divine Service in Crathie Parish Church this morning .",1920-09-27,1920,
152714,Captain MACDON Royal Garrison,1920-03-26,1920,Royal Garrison
152859,Knight Grand Cros . - The Rt . Hon . Sir David HARREL .,1920-03-6,1920,Knight Grand Cros|David HARREL
150621,"The King and Queen of Denmark were present at Divine Service at St. Clement Danes Church , Strand , this morning .",1920-12-6,1920,
153749,"ST . JAMES'S PALACE , OCT . 29 . The Prince of Wales , attended by Capt . the Hon . Piers Legh , was present at Waterloo Railway Station this morning , and on behalf of The King took leave of Major - General Prince Arthur of Connaught upon his departure from England for South Africa .",1920-10-30,1920,JAMES'S|Legh|Arthur
153842,Miss Agnes Keyser had the honour of dining with The King and Queen this evening .,1920-09-6,1920,Agnes Keyser
153406,Brigadier - General the,1920-11-20,1920,
152765,"BUCKINGHAM PALACE , MARCH 1 . Field - Marshal the Earl Haig was received in audience by The King this morning upon relin quishing his appointment as Field - Marshal Commanding - in - Chief the Forces in Great",1920-03-2,1920,
152960,"The Countess Fortescue , Captain Sir Charles Cust , Bt . , R.N. , and Colonel Clive Wigram were in attendance .",1920-05-12,1920,Charles Cust|Clive Wigram
150198,"The King and Queen , accompanied by the Prince Albert , the Princess Mary , the Prince Henry and Princess Christian , arrived at the Castle this afternoon from Buckingham Palace . Their Majesties were received by the Marquis of Cambridge ( Constable and Governor of Windsor Castle ) and the Master of the House hold .",1920-04-3,1920,Albert|Marquis
150040,"The Prince Albert , attended by Wing Commander Louis Greig , presented Colours to the 2nd Battalion , 20th London Regiment , and afterwards unveiled a Memorial , erected at Blackheath , to the men of the 1st and 2nd Battalions of the Regiment who were killed in action during the War .",1920-04-12,1920,Albert|Louis Greig|Memorial|Blackheath
151078,"The King and Queen , the Princess Mary , the Prince Henry , and the Ladies and Gentle men in Waiting attended Divine Service at Sandringham Church this morning .",1920-01-19,1920,
150396,"The Queen , accompanied by the Princess Mary , and attended by the Lady Bertha Dawkins , visited the Y.W.C.A. Portsmouth Club for Girls , 12 , Grosvenor Place , this after",1920-12-13,1920,Bertha Dawkins|Grosvenor Place
150847,Queen Alexandra and the Princess Victoria visited His Royal Highness to - day .,1920-02-24,1920,Queen Alexandra
152762,"MARLBOROUGH HOUSE , MARCH 28 . The King and Queen , with The Princess Mary , The Princess Royal , and Princess Maud , visited Queen Alexandra and remained to luncheon .",1920-03-29,1920,Queen Alexandra
150480,"The King and Queen , with the Princess Mary , the Duke of York , and Prince George : The Princess Royal and Princess Maud , visited Her Majesty and remained to luncheon ..",1920-12-20,1920,Prince George|Majesty
152200,"The Queen , accompanied by the Princess Mary , and attended by Mr. Harry Verney , visited the Royal Horticultural Society's Great Spring Meeting in the Royal Hospital Gardens , Chelsea , this morning .",1920-06-2,1920,Harry Verney
150424,His Excellency The German Ambassador ( Herr Friedrich Sthamer ) was received by His Royal Highness this morning .,1920-12-14,1920,Herr Friedrich Sthamer
153776,"The Viscount Farquhar , Sir Walter Lawrence , Bt . , and the Very Revd . A. Wallace Williamson , D.D. , have left the Castle , and Sir James Reid , Bt . , has arrived .",1920-09-14,1920,The Viscount Farquhar|Walter Lawrence|A. Wallace Williamson|James Reid
152671,The King and Queen gave a Dinner Party,1920-03-25,1920,
152644,"Companions . - Captain Oliver LEGGETT , EN . , and Lieutenant Colonel John BORASTON , Royal Field Artillery ( also received the Insignia of an Officer of the Most Excellent Order of the British Empire ( Military Division ) ) .",1920-03-25,1920,Oliver LEGGETT|John BORASTON
153581,The Earl of Onslow and Sir Edward Walling ton have succeeded the Lord Somerleyton and Major the Hon . Richard Molyneux as Lord and Groom in Waiting to The King .,1920-10-11,1920,Edward Walling ton|Richard Molyneux|Groom
153667,"The Lord d'Abernon ( His Majesty's Ambassa dor Extraordinary and Plenipotentiary at Berlin ) and Mr. William Bridgeman , ( Secretary for Mines ) , were sworn in Members of His Majesty's Most Honourable Privy Council . Sir Almeric FitzRoy was in attendance as Clerk of the Council .",1920-10-14,1920,Majesty|William Bridgeman|Almeric FitzRoy|Clerk
153565,"The Duke of York , attended by Wing - Com mander Louis Greig , left the Palace for Bishops thorpe , York , on a visit to the Archbishop of York .",1920-11-9,1920,Louis Greig
152563,"Their Majesties , accompanied by the Prince Albert , the Princess Mary , and the Prince Henry , gave an Afternoon Party at Buckingham Palace .",1920-03-19,1920,Albert
151167,"The King and Queen , accompanied by the Princess Mary , visited Rothesay Castle this afternoon , and afterwards honoured the Marquis and Marchioness of Bute with a visit . Admiral Sir Charles Madden , Bt . ( Cammander - in Chief , Atlantic Fleet ) , Vice - Admiral Sir Arthur Leveson ( Vice - Admiral Commanding 2nd Battle Squadron ) , Rear - Admiral Michael Hodges ( Rear Admiral Commanding Destroyer Flotillas , Atlantic Fleet ) , Commodore Cyril Fuller , R.N. , Chief of Staff . Captain Henry Buller , R.N. ( H.M.S. Malaya ) , Com mander John Barron , R.N. ( H.M.S. Wolsey ) , Com mander Robert Ramsay , R.N. ( Submarine M.2 ) , and Major B. Heckstall - Smith ( Secretary , Yacht Racing Association ) , had the honour of dining with Their Majesties this evening .",1920-07-12,1920,Rothesay Castle|Marquis|Charles Madden|Arthur Leveson|Michael Hodges|Commanding Destroyer|Cyril Fuller|Henry Buller|John Barron|H.M.S. Wolsey|Robert Ramsay|Major B. Heckstall - Smith
152902,"The Band of the Coldstream Guards played a selection of music during the Investiture , under the direction of Major J. Mackenzie Rogan .",1920-03-6,1920,J. Mackenzie Rogan
151130,"The King and Queen , Queen Alexandra , the Queen of Norway with the Prince Olaf , the Prince of Wales , the Prince Albert ,, the Princess Mary , the Prince Henry , the Prince George , the Princess Royal with the Princess Maud , and the Ladies and Gentlemen in Wait ing , attended Divine Service at Sandringham Church this morning .",1920-01-5,1920,Queen Alexandra|Albert
151930,His Majesty held an Investiture in the Quadrangle of the Palace at 11 o'clock .,1920-06-12,1920,Majesty
152259,"The King and Queen , accompanied by the Princess Mary , and attended by the Lady Ampthill , Major - General the Lord Ranks borough , and Major Reginald Seymour , honoured His Excellency the United Ambassador and Mrs. Davis with presence at Dinner this evening at the States Embassy , Chesham Place .",1920-06-8,1920,Ranks|Reginald Seymour|Davis|Chesham Place
150682,"Admiral of the Flect the Viscount Jellicoe and the Right Hon . Edward Shortt , M.P. , had audiences of His Majesty , and Lieut . - General Sir John du Cane ( upon his appointment as Master - General of the Ordnance ) , and Lieut . W. H. Bremner , R.N. ( whom The King invested with the Insignia of a Companion of the Dis tinguished Service Order ) had the honour of being received by His Majesty .",1920-02-12,1920,Edward Shortt|M.P.|Majesty|Lieut|John du Cane|W. H. Bremner|Majesty
151619,The Princess of Monaco has left Claridge's Hotel for Yorkshire .,1920-07-24,1920,Claridge
153291,"MARLBOROUGH HOUSE , Nov. 9 . The Princess Royal , with Princess Maud . visited Queen Alexandra to - day , and remained . to luncheon .",1920-11-10,1920,Queen Alexandra
151070,"ST . JAMES'S PALACE , S.W. , JAN . 13 . The Prince of Wales , attended by Captain The Hon . Piers Legh , left London for Sandring . ham this afternoon .",1920-01-14,1920,JAMES'S|The Hon|Legh
153662,"ST . JAMES'S PALACE , S.W. , Oct. 12 . The Prince of Wales visited Queen Alexandra at Marlborough House and remained to Luncheon .",1920-10-13,1920,JAMES'S|Queen Alexandra|Luncheon
152046,"The Duchess of Portland , The Hon . Charlotte Knollys , General the Rt . Hon . Sir Dighton Pro byn , and Colonel Sir Henry Streatfeild , were in attendance .",1920-06-24,1920,Charlotte Knollys|Dighton Pro|Henry Streatfeild
152114,Sir Ponnambalam and Lady Arunachalam had the honour of being received by The King and Queen .,1920-06-28,1920,Ponnambalam|Lady Arunachalam
153155,"The Prince Albert , attended by Wing - Com mander Louis Greig , was present at a Parade of the Inspectors of the National Society for the Prevention of Cruelty to Children , in the Garden of St. James's Palace , this morning . His Royal Highness has left the Palace .",1920-05-27,1920,Albert|Louis Greig
152611,"The Band of the Welsh Guards played a selection of music during the Investiture , under the direction of Lieutenant Andrew Harris .",1920-03-22,1920,Andrew Harris
151728,"The Duke of York , attended by Wing - Com mander Louis Greig , arrived at the Palace this evening from Wynyard Park , Stockton - on - Tees .",1920-07-2,1920,Louis Greig|Stockton
153381,"BUCKINGHAM PALACE , Nov. 17 . Princess Alice ( Countess of Athlone ) visited The Queen and remained to Luncheon .",1920-11-18,1920,Alice|Luncheon
152760,"Their Majesties , accompanied by the Princess Mary , visited Queen Alexandra at Marlborough House , and remained to Luncheon .",1920-03-29,1920,Queen Alexandra|Luncheon
152014,"WINDSOR CASTLE , JUNE 19 . Their Majesties ' Guests have left the Castle . The Archbishop of Sydney and Mrs. Wright have arrived .",1920-06-21,1920,Wright
151126,"The Hon . Charlotte Knollys , the Hon . Lucia White , General the Right Hon . Sir Dighton Probyn , and Colonel Sir Arthur Davidson were in attendance upon Her Majesty .",1920-01-29,1920,Charlotte Knollys|Lucia White|Dighton Probyn|Arthur Davidson
153051,The King visited Queen Alexandra this after,1920-05-14,1920,Queen Alexandra
153360,"The King and Queen , the Prince of Wales , the Princess Mary , and the Ladies and Gentle men in attendance , were present at Divine Service in the Private Chapel this morning .",1920-11-15,1920,
152239,"The Queen , and the Members of the Royal Family , drove to Hyde Park and witnessed the Trooping of The King's Colour .",1920-06-7,1920,
151344,Lieut . - Colonel J. G. McConaghy ( Officer in Charge ) and The King's Indian Orderly Officers were in attendance .,1920-07-21,1920,Lieut|J. G. McConaghy
152951,"Sir Aston Webb ( President of the Royal Academy of Arts ) and Mr. W. R. Lamb ( Secre tary ) were received in audience by The King this morning , and submitted the business of the Institution .",1920-05-11,1920,Aston Webb|W. R. Lamb
150697,"The Prince of Wales , attended by Captain the Lord Claud N. Hamilton , presided at the Festival Dinner of the Royal Commercial Travellers ' Schools , which was held at the Con naught Rooms , this evening .",1920-02-14,1920,Claud N. Hamilton|Schools
152476,The King visited Queen Alexandra at Marl borough House this afternoon .,1920-03-15,1920,Queen Alexandra
150418,"The Viscountess Novar , Dame Margaret Lloyd George , the Right Hon . Andrew Fisher ( High Com missioner for the Commonwealth of Australia ) and Mrs. Fisher , Colonel the Hon . Sir James Allen ( High Commissioner for the Dominion of New Zealand ) and Lady Allen , and Mrs. Edward Lucas had the honour of being invited , but were unavoidably pre vented from obeying Their Majesties ' commands .",1920-12-14,1920,Margaret Lloyd George|Andrew Fisher|Fisher|James Allen|Lady Allen|Edward Lucas
152926,"Her Majesty , accompanied by the Princess Victoria , visited the King and Queen at Buck ingham Palace and remained to luncheon .",1920-03-8,1920,Buck
150370,"The King and Queen , The Duke of York , The Princess Mary , Their Majesties ' guests , and the ladies and gentlemen in attendance were present at Divine Service on board the Royal yacht this morning .",1920-08-9,1920,
153829,"The Viscount Knollys ( Lord in Waiting to Queen Alexandra ) represented Her Majesty at the Memorial Service for Lady . Edward Cavendish , which took place at the Church of St. Martin's - in - the - Fields yesterday .",1920-09-30,1920,The Viscount Knollys|Queen Alexandra|Edward Cavendish
151145,"The Bands of the 2nd Dragoons ( Royal Scots Greys ) , the Scots Guards , and the Royal Scots ( Lothian Regiment ) , and the Pipers of the Scots Guards and of the Royal Scots have played selections of music at Holyrood Palace during Their Majesties ' residence .",1920-07-10,1920,
153267,"The King and Queen visited Queen Alexandra at Marlborough House , and Field - Marshal the Duke of Connsught at Clarence House , this afternoon .",1920-05-7,1920,Queen Alexandra
153820,"Queen Alexandra , the Princess Victoria , and Prince Viggo of Denmark , with the ladies and gentlemen in waiting , were present at Divine Service in Sandringham Church this morning . The Rev. A. Rowland Grant , B.D. ( Domestic Chaplain to the King and Hon . Domestic Chaplain Alexandra ) , officiated ,",1920-09-27,1920,Queen Alexandra
150077,"By command of The King the Viscount Sand hurst ( Lord Chamberlain ) was in attendance at Victoria Railway Station this morning , and on behalf of The King , took leave of The King of Sweden upon his departure from England .",1920-04-17,1920,
151156,"Admiral Sir Herbert Heath ( Commander - in Chief , Coast of Scotland ) and staff and Brigadier General J. A. Strick and the staff of the Scottish © Command were in attendance at the railway station .",1920-07-12,1920,Herbert Heath|J. A. Strick
150950,"The Right Hon . Sir Laming Worthington Evans , Bt . , M.P. ( Minister of Pensions ) also had an audience of His Majesty , and Major - General G. D. Jeffreys ( upon his appointment as General Officer Commanding , London District ) had the honour of being received by The King .",1920-02-27,1920,Laming Worthington Evans|M.P.|Majesty|G. D. Jeffreys
152758,"The Service was conducted by the Rev. Canon Edgar Sheppard , D.D. ( Sub - Dean of His Majesty's Chapels Royal and Domestic Chaplain ) , and the Bishop of Chester preached",1920-03-29,1920,Canon Edgar Sheppard|Majesty|Domestic Chaplain
150056,"WINDSOR CASTLE , APRIL 13 . The King of Sweden visited The King and Queen and remained to Luncheon .",1920-04-14,1920,The King of Sweden|Luncheon
153438,"BUCKINGHAM PALACE , Nov. 29 . The King and Queen , accompanied by the Princess Mary , and attended by the Ladies and Gentlemen in Waiting , arrived at the Palace this morning from York Cottage , Sandringham .",1920-11-30,1920,Sandringham
150591,"The King of Denmark received at Buckingham Palace this morning a Deputation from The Buffs ( East Kent Regiment ) , of which His Majesty is Colonel - in - Chief , headed by General the Right Hon . Sir Arthur Paget ( Colonel of the Regiment ) .",1920-12-3,1920,Majesty|Arthur
150857,The King held an Investiture in the Ball Room of the Palace at 11 o'clock this morning .,1920-02-26,1920,
153363,"The King and Queen of Spain , and Field Marshal the Duke of Connaught visited The King and Queen this afternoon .",1920-11-15,1920,
152617,"The Service was conducted by the Revd . Canon Edgar Sheppard , D.D. ( Sub - Dean of His Majesty's Chapels "" Royal and Domestic Chap lain ) , and the Revd . F. R. Barry , D.S.O. ( Principal of the Service Candidates School , Knutsford ) preached the Sermon .",1920-03-22,1920,Canon Edgar Sheppard|Majesty|F. R. Barry
150089,"The Prince Albert , attended by Wing - Com mander Louis Greig , arrived at the Castle from Newcastle .",1920-04-19,1920,Albert|Louis Greig
152487,"The Prince Albert and the Prince Henry , attended by Wing - Commander Louis Greig , have arrived at the Palace .",1920-03-16,1920,Albert|Louis Greig
150700,"The King inspected , in the Quadrangle of the Palace this morning , Motor Omnibus No .. B.43 which was on War Service with the Motor Transport , British Expeditionary Force , France , from 1914 to 1919 , together with a number of Drivers and Conductors who have seen service Overseas .",1920-02-16,1920,
150610,"His Majesty , attended by Colonel Clive Wigram and Major Reginald Seymour , was present at the Association Football Match between Chelsea and the Arsenal , which took place at Stamford Bridge , this afternoon .",1920-12-6,1920,Majesty|Clive Wigram|Reginald Seymour
152376,The Band of the Grenadier Guards played a selection of music during the Investiture .,1920-03-11,1920,
152752,"The King visited Manchester yesterday , attended by Captain Sir Bryan Godfrey Faussett , R.N. , and Colonel Clive Wigram .",1920-03-29,1920,King|Manchester|Bryan Godfrey Faussett|Clive Wigram
152924,"Queen Alexandra and the Princess Victoria , attended by the Ladies and Gentlemen in Wait ing , were present at Divine Service in the Marlborough House Chapel this morning .",1920-03-8,1920,Queen Alexandra
151134,"Captain the Hon . Piers Legh represented His Royal Highness at the Memorial Service to the late Mrs. H. B. Grigg , which was held at Holy Trinity , Sloane - street , this afternoon .",1920-01-6,1920,Legh|H. B. Grigg
